{
  "doc_id": "doc_11",
  "metadata": {
    "title": "期权高频系列（四）凸性套利机会解析",
    "authors": [
      "姜 沁",
      "康遵禹"
    ],
    "publication_year": 2024
  },
  "original": {
    "research_scenario": {
      "description": "研究旨在提供日内分钟级别下凸性套利环境分析和历史回溯表现，以中证1000股指期权为例。",
      "source_locators": [
        "<!-- page: 1 --> 报告要点"
      ]
    },
    "economic_mechanism": {
      "description": "期权价格关于行权价的曲线具有凸性，当不同行权价的期权不满足特定不等式关系时，出现套利机会。",
      "source_locators": [
        "<!-- page: 4 --> 一、凸性套利原理"
      ]
    },
    "feature_formulas": [
      {
        "name": "认购期权凸性不等式",
        "formula": "\\lambda C_{1} + (1 - \\lambda)C_{3} \\geqslant C_{2}",
        "variables": [
          {
            "symbol": "C_{1}, C_{2}, C_{3}",
            "meaning": "不同行权价的认购期权价格"
          },
          {
            "symbol": "\\lambda",
            "meaning": "权重系数，计算公式为 \\lambda = \\frac{K_{3} - K_{2}}{K_{3} - K_{1}}"
          }
        ],
        "source_locators": [
          "<!-- page: 4 --> 图表1"
        ]
      },
      {
        "name": "认沽期权凸性不等式",
        "formula": "\\lambda P_{1}+(1-\\lambda)P_{3} \\geqslant P_{2}",
        "variables": [
          {
            "symbol": "P_{1}, P_{2}, P_{3}",
            "meaning": "不同行权价的认沽期权价格"
          },
          {
            "symbol": "\\lambda",
            "meaning": "权重系数，计算公式同上"
          }
        ],
        "source_locators": [
          "<!-- page: 4 --> 图表1"
        ]
      }
    ],
    "data_processing": {
      "description": "1）筛选前一个交易日期权成交量前5的认沽、认购合约序列；2）在上述合约池中，筛选日内分钟收盘价不满足凸性关系的合约对。",
      "source_locators": [
        "<!-- page: 4 --> (二)凸性套利环境分析"
      ]
    },
    "testing_methods": {
      "description": "进行开平仓的参数敏感性测试，包括开仓阈值测试、平仓时间测试和止盈止损测试。",
      "source_locators": [
        "<!-- page: 8 --> 二、凸性套利开平仓参数测试"
      ]
    },
    "robustness_and_failures": {
      "description": "策略受期权市场流动性影响较大，流动性不佳时策略容量显著下降。",
      "source_locators": [
        "<!-- page: 15 --> (二)资金容量估算"
      ]
    },
    "tradability": {
      "description": "在考虑了交易成本后，策略年化收益率影响在0.5%-1%左右，止盈条件下影响更大。",
      "source_locators": [
        "<!-- page: 13 --> (一)考虑交易成本下的策略收益测算"
      ]
    }
  },
  "adaptation": {
    "project_fit": "该研究主要针对期权市场的凸性套利，与期货日内单合约交易场景差异较大，直接适用性有限。",
    "adjustments_needed": "需要将期权凸性套利策略调整为适用于期货市场的统计套利策略，可能需要重新设计套利条件和交易规则。",
    "missing_fields": [
      "期权价格数据",
      "不同行权价合约数据"
    ],
    "data_sufficiency": "insufficient",
    "replication_mode": "infeasible"
  },
  "extensions": [
    {
      "hypothesis": "可以考虑将凸性关系的思想应用于期货合约不同到期月份的价格关系，寻找统计套利机会。",
      "rationale": "虽然期货市场没有行权价的概念，但不同到期月份的合约价格之间可能存在类似的凸性关系。",
      "source_locators": [
        "<!-- page: 4 --> 一、凸性套利原理"
      ],
      "basis_evidence_ids": []
    },
    {
      "hypothesis": "可以借鉴止盈策略的思想，在期货日内交易中设置动态止盈点以提高交易频次和收益。",
      "rationale": "研究显示止盈策略能显著提升交易频次和收益，这一思想可迁移至期货交易。",
      "source_locators": [
        "<!-- page: 12 --> 图表24"
      ],
      "basis_evidence_ids": []
    }
  ]
}