{
  "doc_id": "doc_08",
  "metadata": {
    "title": "量价指纹模型的迭代:行为选股与条件风格收益的协同建模",
    "authors": [
      "沈芷琦",
      "刘富兵",
      "诸格慧明"
    ],
    "publication_year": 2026
  },
  "original": {
    "research_scenario": {
      "description": "研究将日内量价序列视为特殊的行为语言，通过自监督学习生成日级量价指纹。新版模型专注于描述资金参与、订单变化和流动性演化，避免将训练期收益偏好编码进指纹。",
      "source_locators": [
        "<!-- page: 1 -->"
      ]
    },
    "economic_mechanism": {
      "description": "模型通过预测买方压力、撤单压力、委托激进度、大资金参与、波动状态和流动性状态等行为变量，学习市场行为动力学而非直接预测收益。",
      "source_locators": [
        "<!-- page: 7 -->"
      ]
    },
    "feature_formulas": [
      {
        "name": "买方压力预测",
        "formula": "Y_i \\sim \\mathtt{Beta}(a_i, b_i), \\qquad \\mathbb{E}[Y_i] = \\cfrac{a_i}{a_i + b_i}",
        "variables": [
          {
            "symbol": "Y_i",
            "meaning": "主动买入成交额占总成交额的比例"
          },
          {
            "symbol": "a_i, b_i",
            "meaning": "Beta分布参数，决定分布均值和形状"
          }
        ],
        "source_locators": [
          "<!-- page: 11 -->"
        ]
      },
      {
        "name": "撤单压力预测",
        "formula": "Y_i \\sim \\mathrm{LogNormal}(\\mu_i, \\sigma_i)",
        "variables": [
          {
            "symbol": "Y_i",
            "meaning": "撤单额相对挂单总额的比例"
          },
          {
            "symbol": "\\mu_i, \\sigma_i",
            "meaning": "对数正态分布参数"
          }
        ],
        "source_locators": [
          "<!-- page: 11 -->"
        ]
      }
    ],
    "data_processing": {
      "description": "输入62项分钟级特征，包括价格路径、成交流、参与者结构、挂单供给与订单激进度、撤单状态。预处理包括复权处理、规模差异调整和日内季节性处理。",
      "source_locators": [
        "<!-- page: 8 -->",
        "<!-- page: 9 -->"
      ]
    },
    "testing_methods": {
      "description": "使用GRU模型处理20个交易日的指纹序列和日线价量状态，通过AlphaHead和BetaHead分别输出个股分数和截面共同收益结构。",
      "source_locators": [
        "<!-- page: 22 -->",
        "<!-- page: 23 -->"
      ]
    },
    "robustness_and_failures": {
      "description": "初版模型在2026年市场风格切换时出现回撤，主要原因是预训练阶段引入了收益方向预测任务，导致指纹嵌入了训练期的风格偏好。",
      "source_locators": [
        "<!-- page: 6 -->",
        "<!-- page: 7 -->"
      ]
    },
    "tradability": {
      "description": "模型在中证1000、中证500和沪深300指数增强框架下进行了测试，展示了在不同约束条件下的实际交易表现。",
      "source_locators": [
        "<!-- page: 26 -->",
        "<!-- page: 27 -->",
        "<!-- page: 28 -->"
      ]
    }
  },
  "adaptation": {
    "project_fit": "模型的行为预测目标和结构化收益建模框架适合期货日内交易场景，但需要调整输入特征和预测时间尺度。",
    "adjustments_needed": "需要将分钟级特征调整为快照数据，并缩短预测时间尺度以适应日内平仓的交易规则。",
    "missing_fields": [
      "逐笔交易数据",
      "盘口深度数据"
    ],
    "data_sufficiency": "partial",
    "replication_mode": "adjust"
  },
  "extensions": [
    {
      "hypothesis": "基于买方压力和撤单压力的动态平衡构建日内趋势强度指标",
      "rationale": "原文显示这两类行为预测具有互补性，可组合为趋势健康度判断",
      "source_locators": [
        "<!-- page: 11 -->"
      ],
      "basis_evidence_ids": []
    },
    {
      "hypothesis": "利用五房间表示的权重分布构建流动性脆弱性预警信号",
      "rationale": "原文表明不同房间对应不同行为机制，异常分布可能预示流动性变化",
      "source_locators": [
        "<!-- page: 12 -->"
      ],
      "basis_evidence_ids": []
    }
  ]
}