{
  "doc_id": "doc_06",
  "metadata": {
    "title": "日内资金流策略标准化与信号化机制指增中性专题报告（七）",
    "authors": [
      "熊鹰"
    ],
    "publication_year": 2026
  },
  "original": {
    "research_scenario": {
      "description": "研究基于中证1000股指期货（IM）Level-2高频数据，构建订单簿买卖对比因子、订单簿流动性失衡因子、小单主导度3个资金流因子，进行日内择时策略研究。",
      "source_locators": [
        "<!-- page: 3 --> Section 一、（一）前期研究回顾"
      ]
    },
    "economic_mechanism": {
      "description": "通过Z-score标准化方法捕捉因子偏离历史均值的程度，利用Hysteresis双阈值机制实现开仓与平仓决策解耦，过滤噪声并保留趋势敞口。",
      "source_locators": [
        "<!-- page: 7 --> Section 三、（二）Hysteresis双阈值法"
      ]
    },
    "feature_formulas": [
      {
        "name": "Z-score标准化",
        "formula": "Z = \\frac{X - \\mu}{\\sigma}",
        "variables": [
          {
            "symbol": "X",
            "meaning": "当前因子值"
          },
          {
            "symbol": "μ",
            "meaning": "滚动窗口内的因子均值"
          },
          {
            "symbol": "σ",
            "meaning": "滚动窗口内的因子标准差"
          }
        ],
        "source_locators": [
          "<!-- page: 4 --> Section 二、（一）取样机制对比"
        ]
      }
    ],
    "data_processing": {
      "description": "使用中证1000股指期货（IM）2022年9月1日至2026年6月24日的Level 2行情数据，采用三种Z-score取样机制（全局/主力内部/全周期计算取主力）进行标准化处理。",
      "source_locators": [
        "<!-- page: 5 --> Section 二、（二）回测结果展示"
      ]
    },
    "testing_methods": {
      "description": "通过全样本回测比较三种Z-score取样机制与两种信号生成机制（单阈值/Hysteresis双阈值）的表现，并进行参数敏感性检验。",
      "source_locators": [
        "<!-- page: 9 --> Section 三、（三）参数敏感性检验"
      ]
    },
    "robustness_and_failures": {
      "description": "检验换月空窗期效应，排除策略优异表现源于空窗期规避亏损行情的可能性；分析策略在上涨、下跌行情中的收益特征，验证策略对下跌行情的适配性更强。",
      "source_locators": [
        "<!-- page: 6 --> Section 二、（三）换月空窗期效应检验"
      ]
    },
    "tradability": {
      "description": "策略在全样本区间费后年化收益率达12.59%，夏普比率1.88，最大回撤-4.55%，交易成本设定为单边手续费万五。",
      "source_locators": [
        "<!-- page: 10 --> Section 四、结论与展望"
      ]
    }
  },
  "adaptation": {
    "project_fit": "该研究的Z-score标准化和Hysteresis双阈值机制适用于期货日内单合约交易，能够有效过滤噪声并保留趋势敞口，适合高频或快照数据环境。",
    "adjustments_needed": "需要调整Z-score滚动窗口大小以适应日内交易频率，并确保所有特征仅使用历史信息。",
    "missing_fields": [],
    "data_sufficiency": "sufficient",
    "replication_mode": "adjust"
  },
  "extensions": [
    {
      "hypothesis": "在期货日内交易中引入动态缓冲带机制，根据市场波动率调整Hysteresis双阈值的差值，以进一步优化交易信号。",
      "rationale": "原文中Hysteresis双阈值通过固定差值（0.3）吸收噪声，但市场波动率变化时，固定差值可能不足或过度。动态调整可更好适应不同市场状态。",
      "source_locators": [
        "<!-- page: 7 --> Section 三、（二）Hysteresis双阈值法"
      ],
      "basis_evidence_ids": []
    },
    {
      "hypothesis": "结合订单簿流动性失衡因子与小单主导度因子，构建复合资金流指标，增强对短期价格变动的预测能力。",
      "rationale": "原文中多个资金流因子独立使用，复合指标可能捕捉更全面的市场微观结构信息。",
      "source_locators": [
        "<!-- page: 3 --> Section 一、（一）前期研究回顾"
      ],
      "basis_evidence_ids": []
    }
  ]
}