{
  "doc_id": "doc_02",
  "metadata": {
    "title": "0DTE Options and the Price of Tail Protection",
    "authors": [
      "James O'Donovan"
    ],
    "publication_year": 2026
  },
  "original": {
    "research_scenario": {
      "description": "The study examines the impact of introducing daily same-day-expiry (0DTE) SPX options on the implied volatility skew across different tenors, particularly focusing on the compression of put skew.",
      "source_locators": [
        "<!-- page: 3 --> Section 1 Introduction"
      ]
    },
    "economic_mechanism": {
      "description": "The introduction of fully-daily 0DTE contracts affects non-0DTE skew through two channels: a reduction in the equilibrium compensation dealers require to warehouse put-side inventory and a shift in customer demand across tenors and moneyness.",
      "source_locators": [
        "<!-- page: 19 --> Section 5.4 Mechanism"
      ]
    },
    "feature_formulas": [
      {
        "name": "Put-vs-ATM Skew",
        "formula": "sk_{i,t,T} = IV_{i,t,T,-25\\Delta}^{P} - IV_{i,t,T,-50\\Delta}^{P}",
        "variables": [
          {
            "symbol": "IV_{i,t,T,-25\\Delta}^{P}",
            "meaning": "Implied volatility of a 25-delta put at tenor T"
          },
          {
            "symbol": "IV_{i,t,T,-50\\Delta}^{P}",
            "meaning": "Implied volatility of an at-the-money put at tenor T"
          }
        ],
        "source_locators": [
          "<!-- page: 8 --> Section 3 Data"
        ]
      }
    ],
    "data_processing": {
      "description": "Daily implied volatilities are constructed from raw option-level quotes in the OptionMetrics IvyDB U.S. database. For each (underlying, date), quotes with calendar-day time to expiration in [5, 400] and absolute delta in [0.10,0.60] are selected. Implied volatilities are interpolated using a monotone cubic spline within each expiration and linearly interpolated across expirations to exact target tenors.",
      "source_locators": [
        "<!-- page: 7 --> Section 3 Data"
      ]
    },
    "testing_methods": {
      "description": "A cross-tenor difference-in-differences design is used to identify the effect of 0DTE options on skew compression. The design compares the differential change in skew between short and long tenors relative to a 365-day baseline.",
      "source_locators": [
        "<!-- page: 9 --> Section 4 Empirical Strategy"
      ]
    },
    "robustness_and_failures": {
      "description": "Robustness checks include alternative data sources and skew-measurement conventions, alternative sample windows, and tests for discrete breaks versus smooth secular trends. The study finds that the May 2022 break is not explained by a smooth secular trend.",
      "source_locators": [
        "<!-- page: 23 --> Section 6 Robustness"
      ]
    },
    "tradability": {
      "description": "The study notes that the compression in skew translates into a material reduction in the cost of equity tail insurance, with implied savings of $0.9 to $1.5 billion over the May 2022–June 2024 episode.",
      "source_locators": [
        "<!-- page: 22 --> Section 5.5 Economic Magnitude"
      ]
    }
  },
  "adaptation": {
    "project_fit": "The study's focus on short-tenor options and intraday trading dynamics aligns well with the target project scenario of futures intraday trading. However, the specific focus on options rather than futures may limit direct applicability.",
    "adjustments_needed": "To adapt the study's findings to futures intraday trading, the implied volatility skew measures would need to be translated into equivalent futures market metrics. Additionally, the study's reliance on option-specific data (e.g., delta, implied volatility) would require substitution with futures-specific data.",
    "data_sufficiency": "partial",
    "replication_mode": "adjust",
    "missing_fields": [
      "futures-specific volatility measures",
      "intraday futures trading data"
    ]
  },
  "extensions": [
    {
      "hypothesis": "The introduction of daily expirations in futures markets could similarly compress short-term volatility skew, reducing the cost of tail protection for intraday traders.",
      "rationale": "The study's findings on options suggest that increased availability of short-term instruments can reduce the cost of tail protection. This logic may extend to futures markets, where similar dynamics could apply.",
      "source_locators": [
        "<!-- page: 19 --> Section 5.4 Mechanism"
      ],
      "basis_evidence_ids": []
    },
    {
      "hypothesis": "Intraday recycling of gamma exposure through same-session instruments could lower warehousing costs for dealers in futures markets, similar to the observed effect in options markets.",
      "rationale": "The study identifies intraday recycling as a key mechanism for reducing warehousing costs in options markets. Futures markets, with their high liquidity and intraday trading, may exhibit similar cost reductions.",
      "source_locators": [
        "<!-- page: 19 --> Section 5.4 Mechanism"
      ],
      "basis_evidence_ids": []
    }
  ]
}