{
  "doc_id": "doc_05",
  "metadata": {
    "title": "Diversification of Equity Factors - Hierarchical Clustering for better risk allocation",
    "authors": [
      "Robert Smith, PhD",
      "Berowne Hlavaty",
      "Ada Lau",
      "Evan Hu",
      "Marko Kolanovic, PhD"
    ],
    "publication_year": 2018
  },
  "original": {
    "research_scenario": {
      "description": "Investigation of various risk allocation techniques on equity factors capturing Equity Risk Premia or Smart Beta, including traditional approaches like Equal Weight, Minimum Variance, and Risk Parity, as well as newer methods incorporating hierarchical clustering (HRP and HCP).",
      "source_locators": [
        "<!-- page: 3 --> Section 'Diversification of Factors'"
      ]
    },
    "economic_mechanism": {
      "description": "Hierarchical clustering is used to group similar factors, allowing risk allocation schemes to be applied at the cluster level, which removes redundant exposures and improves diversification. This approach is particularly beneficial for simpler allocation schemes like Equal Weight and Inverse Volatility.",
      "source_locators": [
        "<!-- page: 3 --> Section 'Diversification of Factors'",
        "<!-- page: 13 --> Figure 9"
      ]
    },
    "feature_formulas": [
      {
        "name": "Distance Metric",
        "formula": "d_{i,j} = \\sqrt{(1 - \\rho_{i,j}) / 2}",
        "variables": [
          {
            "symbol": "d_{i,j}",
            "meaning": "Distance between assets i and j"
          },
          {
            "symbol": "\\rho_{i,j}",
            "meaning": "Correlation between assets i and j"
          }
        ],
        "source_locators": [
          "<!-- page: 9 --> Section 'Distance metric'"
        ]
      }
    ],
    "data_processing": {
      "description": "The study uses 70 core equity factors in long-only and long-short forms, plus market hedges. Pairwise correlations are calculated over 12, 36, and 60-month lookback periods, with longer periods providing more stable results. Hierarchical clustering is performed using Python’s Sci-Kit Learn package with various linkage methods (Single, Complete, Average, Ward).",
      "source_locators": [
        "<!-- page: 3 --> Section 'Diversification of Factors'",
        "<!-- page: 9 --> Section 'Assumptions'"
      ]
    },
    "testing_methods": {
      "description": "Backtests are conducted from January 2000 to May 2018, comparing performance of different weighting schemes (EW, IV, HRP, HCP, CRP, MVP, MDP, MVO, ECR, TW) applied to individual factors and clusters. Performance is measured using risk-adjusted returns, with sensitivity tests on cluster distance thresholds.",
      "source_locators": [
        "<!-- page: 10 --> Section 'Backtests'",
        "<!-- page: 30 --> Appendix I"
      ]
    },
    "robustness_and_failures": {
      "description": "Clustering improves performance up to a point; excessive reduction in cluster count leads to overly coarse representations of factor exposures. HRP and HCP, which embed clustering, start strong but show less incremental benefit from additional clustering.",
      "source_locators": [
        "<!-- page: 13 --> Figure 9",
        "<!-- page: 21 --> Figure 19"
      ]
    },
    "tradability": {
      "description": "The approach simplifies portfolio construction by reducing the number of assets to manage. Implementation can be flexible, e.g., by selecting the best-performing factor within each cluster (based on Sharpe ratio, liquidity, etc.), which further boosts performance.",
      "source_locators": [
        "<!-- page: 25 --> Section 'Best in Cluster'",
        "<!-- page: 5 --> Section 'Our approach'"
      ]
    }
  },
  "adaptation": {
    "project_fit": "The hierarchical clustering approach is conceptually applicable to期货日内单合约交易, especially for portfolio construction using multiple factors. However, the original study focuses on monthly rebalancing and equity factors, which differ from高频或快照数据.",
    "adjustments_needed": "The clustering and allocation methods would need to be adapted to高频数据, with shorter lookback periods for correlations and faster rebalancing. Feature formulas must rely solely on historical information without未来数据.",
    "data_sufficiency": "partial",
    "replication_mode": "adjust",
    "missing_fields": [
      "高频数据的具体字段（如tick数据、订单簿深度等）",
      "日内波动率估计"
    ]
  },
  "extensions": [
    {
      "hypothesis": "基于层次聚类的日内因子组合优化：在期货日内交易中，对高频因子进行层次聚类，然后在聚类层面上应用风险平价或波动率倒数加权。",
      "rationale": "原文显示聚类能有效去除冗余因子并改善风险调整后收益。在日内场景中，高频因子可能也存在高度相关性，聚类后加权可能提升组合稳定性。",
      "source_locators": [
        "<!-- page: 3 --> Section 'Diversification of Factors'",
        "<!-- page: 17 --> Section 'HCP and HRP'"
      ],
      "basis_evidence_ids": []
    },
    {
      "hypothesis": "动态聚类阈值调整：根据市场波动率水平自动调整聚类距离阈值，在高波动时段使用更宽松的聚类（减少聚类数量）以降低风险。",
      "rationale": "原文发现存在最优聚类数量（见Page 13 Figure 9）。日内波动率变化剧烈，动态调整阈值可能更好适应不同市场状态。",
      "source_locators": [
        "<!-- page: 13 --> Figure 9",
        "<!-- page: 4 --> Section 'Static is really Dynamic'"
      ],
      "basis_evidence_ids": []
    }
  ]
}